{
  "behavior_id": "crypto-storage-bootstrap-04",
  "case_id": "CASE-CRYPTO-STORAGE-004",
  "catalog_test": "T-CRYPTO-STORAGE-004:database",
  "child_results": [
    {
      "check_id": "phase03-migration-integration",
      "path": "core/target/phase03/results/phase03-migration-integration.json",
      "result_digest": "2e58f8c52ef69a3085bff7b75653d46d345ae415962b28575a170a52b238bd44",
      "sha256": "d376e68952a67630ef8610aa8081131c71fc6a6331a3958338b0844ea37e0bb6"
    }
  ],
  "evidence_path": "EVIDENCE/OBL-CRYPTO-STORAGE-004.json",
  "exit_code": 0,
  "inventory": {
    "accepted_digest": "9d31954a3a4c01709b4db6be783d74ef0aed10c0ecbd2578b6719b37dc7c3009",
    "path": "core/src/main/resources/security/protected-data-inventory.json",
    "sha256": "0f232a20ebcfb161ebd959c57dec1d340383f80b111708ef954542ef75142cd8",
    "validator_result": {
      "check_id": "phase03-protected-inventory",
      "path": "core/target/phase03/results/protected-inventory-result.json",
      "result_digest": "342dc3cd63b0821ff6154ea637de1194f325fbc84c90d7a1c56f675f544c3641",
      "sha256": "2c1dff00ddd02ed5553e9451b731cab58b736d6cf5bd5a0e5f8c45bc77f86fb2"
    }
  },
  "leak_result": {
    "path": "core/target/phase03/results/complete-leak-result.json",
    "result_digest": "c526ae8eb860132c4d56bb5a17a7f333e73b18d537d0adc09d6b4d39e2826110",
    "sha256": "96dd430a04afdf2717867974e907d60a5368aaff2538b36e8c6bc1e59fb6217e"
  },
  "obligation_id": "OBL-CRYPTO-STORAGE-004",
  "owner": "crypto-storage-bootstrap",
  "phase": "03-crypto-storage-bootstrap",
  "requirement_ids": [
    "REQ-NFR-DATA-PROTECTION"
  ],
  "schema_version": "phase03-obligation-evidence-v1",
  "status": "PASS",
  "subject": {
    "path": ".planning/phases/03-crypto-storage-bootstrap/EVIDENCE/tested-inputs.json",
    "sha256": "4a4cc5e45890fe5dccbe0a24b166b5b8f447f0b22f670161aca7eb783129c58c",
    "tested_subject_digest": "acdbdba8db25d3936cb9eb99310c1ee2e14f77f430574109d6c239a6906823c0"
  }
}
